id_EXIST,lang,tweet,label
200779,en,great stuff compliance day discrimination day,0
200780,en,because they re woefully ineffective do not stop or low transmission carry massive risk of side effect and have already kill or maim countless thousand your family member should quit prejudice have no place in the nh especially medical discrimination,0
200783,en,i do learn sexism teacher have a wall of db s with student pic whenever a girl ask what he think be a stupid question he put their pic on the db wall db dumb blonde,3
200784,en,seem to be my mother be into perm in the 70 s and she do them too close together and it burn her hair that be where my theory of the dumb blonde be it be chemically induced right through the skull,1
200786,en,cause you sound like a dumb blonde,1
200788,en,for fuck sake seriously play a dumb blonde be not an excuse for almost destroy democracy,1
200790,en,on an escalator sandwich among nyjc student i be experience a dumb blonde moment to the full rn,1
200791,en,okay dumb blonde i get test and test negative the point be i be more protected than my friend,1
200792,en,your what they call a dumb blonde you have no clue what your talk about at least she answer question unlike your man bidan who doesn t because he can t answer question,1
200794,en,i like the dumb blonde comment where she say she isn t dumb and she isn t blonde,1
200795,en,dumb blonde bleach but blonde take over for the regular dumb blonde aka ainsley airhead the regular on fox amp fiends tomorrow,1
200796,en,single handedly resurrect the dumb blonde meme,1
200797,en,omg i think i be the only one in the world who remember another dumb blonde singer songwriter hoku,1
200798,en,you have to be a dumb blonde it be trump who cause this how dumb can you be,1
200799,en,dumb blonde of the day,1
200800,en,anyone can offer commitment love safety but to offer end you with bare hand it doesn t even take a villain to be sleepless over this ujiko at a fancy dinner confess eternal love afo silently god i just wish a big dumb blonde would fuck me up again,1
200801,en,shhh be quiet or he ll get embarrassed and start preaching,0
200802,en,trump republican embarrass by epic legal order via gop charge with a crime how shocking,0
200803,en,it s so weird that people just can t accept that he do the wrong thing who would ever be embarrass to be aussie,0
200805,en,my friend when they see a song on spotify that be download but not like and the playlist i download be one make by me specifically for downloads and i say that i didn t like that song because i m embarrass to tell them,0
200806,en,i m embarrass for you,0
200807,en,cry and embarrass play undertale rp on roblox and my friend join me i cant,0
200808,en,even if you get embarrass and blush you can still confront hard thing,0
200809,en,apparently you have to be happy about spend your hard earn money to go and watch u get embarrass by liverpool and city and clap the manager after norwich and villa show more ambition,0
200810,en,what a smug arrogant full of himself arse putin must be bricking himself that the prick who embarrass a nation with his don t let scoatlan doon bellowing be monitor the situation jesus do indeed weep,0
200811,en,how embarrass be you to be a member of today s medium,0
200812,en,need the help of 30 fandom to vote and bts still win with a 17m gap aren t you guy embarrassed,0
200814,en,embarrass to say it s martina navratilova a a kid i be a big chris evert fan and then i realize not only how great be a a player but that she be an even well person still be,0
200815,en,man i m embarrass to admit i d draw myself with dio and not in a sfw scenario,0
200816,en,i m aware of the foible of the article in question have be mistakenly issue one myself but i guess i be always too embarrassed of it not to be very careful have to actually use the damned thing,0
200817,en,that s absolutely adorable and witness him be embarrass i love it,0
200819,en,how the fuck can you blow a 24 9 lead at the half fuckin atrocious honestly embarrass,0
200820,en,no no it s he shake his head it s not you i didn t even notice how long be we even face flush clearly embarrass he clasp his hand together it be obvious once you notice it how damage the hand be even with the silk gloves hide the,0
200822,en,they have the ability to kill big difference no court on earth can judge souls only god jesus can,0
200824,en,i don t fvck w religion or religious belief but whenever i saw maria lionza s statue i felt there be something inspire about it she felt like a really empower woman an icon with a great story behind,0
200825,en,yes modern empower woman,0
200826,en,we support vp sara for this come election an empowered woman that be ready to make a big change for the entire philippine,0
200827,en,an empowered woman be not just about be bold and brave a conservative traditional woman can be one they be not weak nor afraid to step out of their comfort zone it s just that different thing empower different people there be no one way to be a woman florence g,0
200828,en,why kill her i find it amuse amp a good show to see this empowered woman kiss low iq biden s as just to work under him if kamala s so smart she d be president by now it will be entertain to see kamala get on her knee amp kiss more ass for her next coveted job,1
200829,en,i m love the sas that anu aunty be give doucheraj and mkk lately her growth of be a timid submissive housewife and semi empower woman be so fun to watch especially when her team kinju samar et al support her,1
200831,en,leni sound like an advocate talaga of community development this be why i m voting for her she s an empowered woman,0
200832,en,this be how an empowered woman talk like gajab shrinate aunty,1
200834,en,the film portray ball a a remarkable fearless and empowered woman who work hard to perfect her art,0
200835,en,that tinnie little typo that change everything she be empower woman and i love that,0
200838,en,you want to be a strong and empowered woman then grow a spine strong enough to look at your own sin and shortcoming square in the eye and be willing to face them head on only weak woman blame men for everything,1
200839,en,empower woman kiss phenomenal queen,0
200840,en,you sound mad bro do the empowered woman hurt your feeling,1
200841,en,i be and i be honor to be celebrate and recognize by a a woman sit at the table for 2021,0
200842,en,bashfully at first grow into acceptance and then empowerment,0
200844,en,incorrect the term use to be use interchangeably with hermaphrodite or eunuch in english however the indian ministry of social justice and empowerment redefine it a of january 2014,0
200845,en,and miss me with this fake black girl empowerment shit we attempt to destroy a man off of her word alone now the court say there s no dna and the police say there s no bullet fragment so the court amp police be still not enough for tory lanez to be absolve,2
200846,en,once make equal to man woman become his superior who can really define woman empowerment and or emancipation,1
200847,en,advanced barista skill train for youth now happen in kampala thank you iwca uganda chapter for support and empower barista house to create a difference in the life of these young star woman in coffee youth skilling woman amp youth empowerment advancement,0
200849,en,james harden hell of a ball player but the absolute definition of a diva completely bail on the rocket die now to bail on the net where he want to go this be the shitty side of the player empowerment era,0
200850,en,hey y all my spiritual empowerment brand be almost to 40k follower on ig mostly everyone on here already follow me but i d really appreciate it if y all could rt this for the people that don t so i can hit my 40k goal by new year it s on ig love y all,0
200851,en,sophia and riley receive the family empowerment scholarship for student with unique ability through they use their education saving account to pay for training session learn how it expand their world,0
200852,en,i appreciate men yang very vocal about woman empowerment amp advocate about our struggle you guy be the best,0
200853,en,never forget that kobe spend an offseason beg the lakers to trade him and they didn t everything with ben simmons be in the hand of the sixer the empowerment talk be nonsense,0
200854,en,first time i m say fuck woman empowerment,1
200855,en,kindly download and signup on the app and witness a new era of digital currency that believe in the empowerment of community,0
200856,en,the late update for include cios leader face unprecedented empowerment and challenge top prediction and what can you learn from with i2m part 2,0
200857,en,they should be empower our community not empower themselves have you not see westminster the past 21 month how dare a tory talk about empowerment after what the con have do in con the nation,0
200860,en,when your super excite today be your first meet with my sister keeper girls empowerment club you race home and design your poster,0
200861,en,idea have consequence richard m weavernotes on epistemology rev john j tooheythere s also a brazilian author i would highly recommend but afaik he have only one full book publish in english,0
200862,en,ha yeah a classic case of epistemology begets ontology,0
200863,en,our tip of the week be the book a continental guide to philosophy by start with 3 fundamental question about metaphysics epistemology and ethic macready guide u through the philosophy of plato descartes hume kant nietzsche schopenhauer and arendt,0
200864,en,read widely always good but important to distinguish ontology realism and epistemology positivism critical realism have commitment to realist ontology but permit epistemic relativism,0
200865,en,modernist figure they could reset everything by start first with epistemology and give up on metaphysics now we be sink into the abyss of postmodernism happy happy joy joy,0
200866,en,be woman sign a letter against terfs it s standpoint epistemology and it almost always have the end effect of trample the disadvantage in a group,0
200867,en,add understanding ravel to my unending list of thing to learn push toward the top since thing that be like knot but be not knot slightly break my epistemology,0
200868,en,no it s an engagement in subjective epistemology i have subjective reason for it and the word we re use all have subjective meaning point at everything i say and go you re say you know that objectively be a bad argument because i only know it subjectively,0
200869,en,her conclusion and her critique of eurocentric analysis masquerade a liberatory be on point but she ignore the fact that anti oedipus have similar critique of colonial epistemology as well,0
200870,en,rand demolishes epistemology with fact and reason,0
200871,en,empirical evidence be of central importance to the science and play a role in various other field like epistemology and law,0
200872,en,tribalism be a matter of social organization not epistemology your malapropism speak volume about how classical liberal overestimate their ability and thus make poor if not reckless steward of their inheritance the person without a tribe be fragile and rootless,0
200873,en,i think a lot of people believe in a soft standpoint epistemology but very few people believe in the existence of a coherent feminist standpoint,0
200874,en,currently do my ma dissertation and try to work out all those wowsers terminology if you can help with ontology epistemology and anything in or even vaguely relate to anything research relate which would help i d be eternally grateful,0
200876,en,since true thought don t come with a special glow announce themselves a true we can t use truth a a marker for well form worthwhile belief in,0
200877,en,i think an objectivism set up pretty big obstacle in the way of appreciate any kind of social epistemology like i think an objectivist view these field always with the suspicion that there be moral relativism and hostility to science lurk behind the page,0
200878,en,don t mind him if you phrase a question like this for a research in qualitative analysis this shit ain t go through ethic or your profs act like english be so hard to comprehend his positionality and epistemology be clearly bias since he doesn t know we learn,0
200879,en,theres a lot tribal epistemology masquerade a skepticism,0
200880,en,i start teach this worldviews lesson today to ks3 today amp the what be real questionnaire from make a fab introduction to a unit look at epistemology i have be use it with yr7 today some of the language be hard but with guidance they could access it,0
200882,en,my dear a wife have never be a servant in her husband s house ekyo kikyuuseinfact it s the husband who be the servant in his home because you have to work hard in order for them to have a good life yes there can never be equality between the two in the family,1
200884,en,jason want to perform a two tailed test for equality between two independent sa,0
200885,en,crt popular definition racial wokeness ensure that equality between the race can never exist because it make it impossible to move beyond racism of the past and tell black people that they be victim of a white supremacist society in which there be no way they can succeed,0
200888,en,wait for the day we have bookmark folder and equality between twt web and app,0
200889,en,what i really dislike about this stuff be the implicit assumption of equality between the author call for u to end our support we might and it would really happen soon and iran stop their support come on,0
200890,en,yah we need equality between both gender cause honestly we way too quick to cancel male than female in society i be not take side but truth be we have all normalize woman cry rape to get back on the other gender i believe nobody i be not part of their relationship,3
200891,en,remember when ryback get fire from wwe for go on the internet and pitch socialist contract equality between upper and low card talent,0
200892,en,terminological meaning sayyid sharif say justice be a point of equality between excess and deviation which keep the side equal and come to a standstill on the truth political system of islam prof ghulam rasool cheema,0
200895,en,the rate comparison of equality between dn and d be bake right in if you make the assumption which be make by the scientist not the model that d be neutral then reject the null be reject equality between dn and a putatively neutral class of site d,0
200897,en,what be this you want me to promote equality between men and woman woman be only about 50 of the world s population why should they get such special attention,1
200898,en,to achieve equality between district and boundary have be remove enable travel anywhere in the region with the same ticket i be sorry for the delay in our reply i hope this help clarify beth 3 3,0
200899,en,this negate all experience of caste oppression and assume historical and modern equality between caste that simply doesn t exist nothing to do with the west it s illogical like i say thing can definitely be hurtful but to say it s casteist be flaw,0
200901,en,let me reiterate that i don t buy asian privilege the same way that i don t buy white privilege fundamentally it s tribal essentialism and that shit be never go to solve any of our problem,0
200902,en,maximalism of welfare wellness well be amp prosperity and minimalism of burden struggle menace trouble amp problem be the very essentialism of leadership,0
200903,en,and thank you for address this essentialism in my opinion be one of the incorrect description of the world that have do the most damage to both individual and society it prevent seek or even allow change and deny the dynamism of the world around u,0
200904,en,you re go to mask up my child and then teach them race essentialism um no and like over my dead body base,0
200905,en,listen to one direction on repeat to write this paper about biological essentialism and the myth of motherhood lt 3 this be the future simon cowell want to create u guy just couldn t see it yet,0
200906,en,pointblank open nervetrainers rebound essentialismdrone letter clothespin,0
200907,en,i feel you make this whole matter even more annoying to deal with be we even refer to theory of human invariance a essentialism pile even more baggage onto the whole mess lmao,0
200908,en,cultural marxism race essentialism postmodern gobbily gook crybaby socialism mental illness daddy issue with a liberal art degree and position of power,0
200909,en,yes but wahi masla hai all these sexology term basically reinforce biological essentialism while try to be inclusive,0
200910,en,and then link an article about creativity vs racial essentialism and somehow miss the point that those idea be exactly why the gop doesn t elevate these people in opposition to the dems who be use it for woke clout the gop just doesn t need them and doesn t care,0
200911,en,beyond the north wind the rise and fall of the mystic north essentialism the house in the cerulean sea the four agreementsoctober every heart a doorway the book of magic the memory police the body keep the score norse mythology circe best light read,0
200912,en,i m fairly certain kendis racial essentialism be in itself pure racism and all people should laugh him out of the public square,0
200913,en,race essentialism be a foundational assumption in the racial reconciliation discourse,0
200915,en,where he be wrong of course be to speak of white liberal and throw out the race essentialism even then there s a lot travel under that liberal banner,0
200916,en,the very idea of alignment that there be objective real category of morality that can be classify in term of good evil law and chaos be essentialism of the kind that be be object to alignment in d amp d be real objective moral differentiation that be surely,0
200917,en,an essentialism conservative old white uncool minority young cool wear sunglass at night must steal their juju,0
200918,en,black people love race essentialism and race science while claim to hate racism,0
200919,en,right amp that s essentialism which be man make system gt gt gt logos the next step be to point out the essentialism amp they can 1 remain silent and be complicit in an essentialist idolatrous praxis or 2 speak up by pick one of the two terminus essentialist v pull back,0
200920,en,why do you need to teach kid about gender essentialism,1
200923,en,you learn that nothing be necessary armour you must carry with you leave utterly speechless by s reading of her poem about how woman and young girl expereince everyday sexism,0
200924,en,i can t understand how a math teacher would discourage passionate young woman from take as much math a possible she want to take the hard class she like work hard at math everyday sexism,3
200925,en,call undermining authority and everyday sexism,0
200927,en,the reality of police everyday sexism and misogyny they joke about rap woman and stuff them in the boot female police officer tell their work story,3
200929,en,eutelsat sign up to french initiative against everyday sexism in the workplace,0
200930,en,the release of the human right commission investigation report be block by firefighter union chief peter marshall who deny claim the state s fire service be beset by everyday sexism that place woman at risk of harm,3
200931,en,an hbo miniseries on catherine the great expected viewer to welcome a 70 something helen mirren play a 30 something in perpetual fury about everyday sexism why i stop watch historical drama,0
200932,en,the trial by laura bateshive book amazon,0
200934,en,cry wolf everyday sexism,0
200936,en,an example of everyday sexism in our university and major discrimination against woman,3
200937,en,what about the warning sign before this happen the joking about kill woman and stuff their body into the boot of car his nickname the rapist the testimony from female officer about the misogyny they have to put up with as detail by everyday sexism,3
200938,en,everyday sexism be worth the time,1
200939,en,md anz steven worrall say workplace harassment be a scourge on our society leader have to realise that just because they be not hear about it it doesn t mean it isn t happen,0
200941,en,don t know if self exoticization be always a matter of be complicit english be a native language it come to u through invader ruler a most others do sure it belong to the privileged but almost the entirety of our anti colonialist discourse be articulate in eng,0
200942,en,in the presence of power asymmetry the line between and exoticization or othering can quickly become blur the be value in see what human being have in common despite different local circumstance that be the principle of humanity,0
200944,en,just go for that urbex bullshit people love and have future lara excavate former olympic village and missile silo you sidestep the colonialism and the exoticization of other culture and you deal constantly with the excess of american culture,0
200945,en,hey i m one of those and while i have nothing but love for femboys it s certainly not a term i d use to describe myself also please be mindful of accept the exoticization of third gender by cissexist anthropologist uncritically,0
200946,en,exoticization of my mental illness be not empathy,0
200947,en,let alone it s mimetic function of reinstate the exoticization of asian flavor present throughout american restaurant an ontological and aesthetic expansion of the white relationship to the exotic that also serve to be anti black,0
200948,en,icymi dodgy language skill relentless exoticization and a bizarre obsession with stoat i read clavell s shogun so you don t have to,0
200949,en,have be in an industry that glorify this and related behavior can confirm exoticization and fetishization be absolutely rampant and have be since they ram their boat into africa except now it s a different kind of socially acceptable it ll never not be weird,0
200950,en,but this be professional journalism not someone be twee to entertain their friend this be something strange i can t figure out whether it s condescension or exoticization or what but it s not normal,0
200951,en,representation without justice be mere exoticization,0
200952,en,the too simple explanation they use drum and that s cool we use psychotherapy and that s crap could be basic exoticization and could end up encouraging prejudice like psychotherapy be useless to fight depression you just need to go sunbathe it s up to you,0
200953,en,i get that oriental in this context be a descriptor of a product not a person but it s still squicky because it imply an outdated concept of exoticization consider the location of the product though it ain t surprising,0
200954,en,heavy thread first thank you for honour u with share this content i think there be a lot of exoticization with people who have psychotic symptom we love story about exotic hard to imagine experience i think a lot of that lxp be co opted and use to build 2,0
200955,en,2 2 racism in the hobby and outside it more difficult so yes they re be call out about it because it s more exoticization and dodgy concept that we don t need to deal with on top of the regular one,0
200956,en,i kno this angered ppl amp while i disagree w it premise josephine baker do capitalize off racial ambiguity colorist exoticization amp those same opportunity werent a available to darker skinned african american female entertainer this delve into it w her role in la cr ole,0
200957,en,exoticization of an otherwise neglect community also i wouldn t put past that lot to send in usurper,0
200958,en,then come d american we be enamor talaga we fell hard our former colonial master be harsh bt these new wyt savior give u chocolate teach u their language nvm d exoticization what s a lil public exhibition a fair we can play d part of zoo animal,0
200960,en,at the same time the exoticization sometimes self exoticization i see of cultural output from country like japan or korea which presuppose that those culture be so different that eu u folk couldn t possibly understand it s a whole thing,0
200961,en,i make joke about myself be fat a fuck because it take the fun out of other people do it to me instead,0
200963,en,extra fat bid at 52,0
200964,en,the difference be despite her be famous and possibly have a lot of money she still doesn t have that many option so she s not curve every other person that ask her out fat female usually just say yes to anyone who ask until they find a relationship that work,1
200965,en,resurge may be a completely natural compound supplement design to enhance deep sleep regenerate metabolism burn fat and reduce,0
200966,en,can t believe ur go so soon this wonderful man lose his life to save his fiance such a gentleman and forever a hero rip my honorary brown brother hope you re hit those fat doinks in heaven go too soon,0
200967,en,yeah here it be if you re under 50 maybe even 60 and healthy your likelihood of be fine be tickle 100 fat doesn t count a healthy vaccinate can spread the virus nearly as easily a unvaxxed since they win t know they re infected eat well vitamin d c exercise,0
200969,en,ok but realistically if i draw a cookie run but human and i give him fat tit he s an adult how much bullying can i expect from the mass,1
200970,en,metabolic confusion be simply switch up your food intake to keep you metabolism burn fat even at rest it really just hormone balance with food rather that take estrogen hormone replacement everyone have a different hormone type and certain food help ur metabolism,0
200971,en,when non vegetarian bring up protein like they re the first one to think of thisvegan food have protein a half cup of bean have the same amount of protein an ounce of meat do with less calorie amp fat kid need protein not specifically meat protein,0
200972,en,but after some thought i realize that her say that meant that i a fat dark skin queer perceive man with semi long acrylic be not foreign to her and that make me really happy,0
