id_EXIST,lang,tweet,label
202233,en,no what we want be that cuba regime release the political prisoner and the child they hold in common jail i be not go to spend my money in cuba so that the repressor buy more instrument of torture i don t want to sponsor the repression in cuba,0
202234,en,end covid repression let life resume via,0
202235,en,sabbagh point out to the need for un to play it role in put an end to the practice of israeli occupation against syrian people in the occupied syrian golan include the operation of repression intimidation arbitrary arrest amp the seizure of land,0
202236,en,if you want to know where current trend be lead attica offer a clue,0
202237,en,you poor delude fool you think you win t be affect allow this cheer it on even in your case and you re open the door to tyranny remember you say this when you find yourself subject to repression,0
202238,en,that be simply not true there be so many different path and strategy that do not involve repression this be repressive and criminal and it will be recognise a such in time no matter how enthusiastically it be deny by the people that hold power and status today,0
202240,en,doesn t claim to defend so why be silent about the destruction of human right in and support but against the will of the people of amp show weapon and repression,0
202241,en,must be base on the bem sex role inventory and,0
202244,en,can you give me an example of assign someone a sex role,0
202248,en,very simple but become controversial while handle society have go a long way wrong the brain setup of 99 99 become script with incorrect info question fell unanswered psychology behind lipstick fashion show attraction amp sex role of culture etc fog dilemma over it,0
202249,en,why do we need to hear about your lizard sex role playing game,0
202252,en,kohlberg l a cognitive developmental analysis of child s sex role concept and attitude in maccoby ee ed the development of sex difference stanford ca stanford university press 1966,0
202253,en,im have the most funny and awkward sex role play thing rn i can t,0
202256,en,drunk halloween sex role playing and costume wishful mf think,0
202257,en,mfw aspen pass the 1974 sex role characteristic questionnaire with fly colour,0
202258,en,on a sidenote it also play the age old wabout the child and claim that the concept of gender identity be increasingly use to gender reassign child who do not conform to sex role stereotype which be just a big pile of bull,0
202259,en,auto correct just change the phrase my six year old to my sex role wtf autocorrect,0
202260,en,bem sex role inventory be a problematic tool,0
202261,en,you must have a hard time read a i state i be not support either side but that s how you leave be if some thing doesn t fit your agenda your automatically a bigot racist sexist etc it s cool think what you want no one important care,0
202263,en,you re not sexist dude there s just alot of hate on the bird app,0
202265,en,it would be unfair to expect woman to be more affectionate than men it s also unfair if men receive less affection than woman woman be naturally more nurturing and men naturally have more agency cause so many problem sexist nonsense,3
202266,en,terrible experience today at micheal e debakey hospital almost no parking crowd wait room veteran not wear mask male make sexist comment about female wait over an hour to have 6 stitch remove have a panic attack 0 5 star today,3
202276,en,ur a sexist mysogynistic woman hater ratio,2
202278,en,like i promise me only want one person and not be comfortable w the idea of date multiple people be not some racist patriarchal sexist conspiracy i just be normal,0
202280,en,keep up the good fight thank you for your bravery in call out the raft of shit misogynistic sexist bullying behaviour,2
202282,en,good because after nearly five month since the ag s report come out the truth be come out about the so called case against that it be less about sexual harassment and more about a political hit job i would enjoy it more if bc would be charge with perjury,0
202288,en,twitter inc twitter and facebook need a specific reporting function for sexual harassment amp misogyny online sign the petition via,3
202293,en,i be tremble when i saw videos b w tj and shanaia i exp sexual harassment i know what it look like kung kuya ka lang o nagtitake advantage sa babae sorry i can not finish the video i hope may housemate na pumuna kay tjforce evict tjprotect shanaia gomez,3
202294,en,in 2014 hermain cain be accuse of sexual harassment of several woman see he suspend his campaign he be a tea party member trump choose him a a cabinet member he be accuse of use federal money to fix his house,3
202295,en,might want to sit this one out,0
202296,en,lincoln project stand for gay sexual harassment and race fraud,0
202298,en,berkeley friend do you know someone who s have experience deal with the center for student conduct ask for a close friend who receive a letter amp be work through the process would appreciate any help not a sexual harassment case not involve faculty thanks,0
202302,en,nj the majority of the population have clear enough sexual identity for evolution and sexual selection to work just fine while at the same time sex a a spectrum be a real thing for a small to medium size minority,0
202305,en,so be the go to register a x or just for the moment when everyone be make a production of their sexual identity good grief this world of young people be mess up,0
202306,en,one of the great aspect of most bate club be that regardless of your sexual identity or prefer sexual position you can find community and self pleasure in these communal driven space check out this 2019 gq article to dive deeper into this topic,0
202307,en,kid struggle with sexual identity issue aren t the only one who need to hear these conversation all kid could benefit from a curriculum that educate on these issue understand lead to tolerance,0
202308,en,how long have you be brag about your border response a year now and base on your almost daily fear monger about drug and alien cross the border it have be an absolute failure go back to your day job a fear monger on book sexual identity the economy,0
202309,en,nothing new under the sun the agenda be go forward let s stand up a believer my prayer go to those struggle with their sexual identity may god give you a revelation that you be his your sex doesn t give you an identity,0
202311,en,a a bisexual i feel comfortable in assert that we re by far the most annoying sexual identity that get put in the acronym,0
202312,en,fuck off pronoun be not equal to gender nor sexual identity loser,0
202313,en,i will never understand how nigga be worry about someone s sexual identity and lifestyle unless they be date but even then why be you worried about what others that you don t know personally do,0
202314,en,i just don t get how people can feel threaten by someone s gender identity or sexual identity richard think we be good than that,0
202317,en,my classmate choose homosexual in the find your valentine site in college say she think homo homosapiens not a sexual identity girl,0
202318,en,for bring story of find pride in your gender identity amp sexual identity into your classroom with our free curriculum for about the narrative hero of,0
202319,en,when i invest into a project i don t care about the founder s criminal record age or race or sex or sexual identity only one thing matter his her trustworthiness and ready able willing to deliver anything what be the project s main aim goal everyone deserve a chance,0
202320,en,tell me how it be your business to discuss any other person s sexual identity at all what do you care if they aren t bothering you personally you can identify a a goose and it doesn t bother me,0
202321,en,i m just be a good friend and u turn it into sexual orientation,0
202322,en,these comment be absolutely not a reflection of our organization s mission and value bidmc be commit to provide equitable care to all patient regardless of vaccination status race gender sexual orientation income level or any other factor,0
202323,en,maybe he be rob and kill and it didn t have a thing to do with his sexual orientation,0
202324,en,you re base your opinion on a general idea of the word discrimination discrimination be a legal term that apply to specific establish protected class like sexual orientation that s why you can refuse service to a person base on a mask but not base on be gay,0
202325,en,i be put together a lecture on model stis and be struggle with how to best use word associate with assumption of binary gender and sexual orientation any recs reference on balance acknowledge diversity with the use of assumption for model practicality,0
202326,en,hate to say this guy but i never saw race gender sexual orientation or politics a classifier grow up i never saw the need to know these thing in order to treat others with the same dignity a any human be then i watch the news now it s all i we see,0
202327,en,listen to your podcast t day there be no reason any teacher shld be have a discussion w their student concern sexual orientation or gender theory or their personal relationship school district need to rethink such lunacy before hire,0
202328,en,i don t give a fuck about label like if someone put a gun in my mouth and tell me to say my sexual orientation i would probably say murrrphhhur,0
202329,en,can math teacher just stick to teach math social study stick to social study i never remember a teacher come into my classroom grow up and explain to me what they be their sexual orientation etc they need to get back to teach the 3 r s and that s it,0
202330,en,everyone regardless of the color of their skin or someone s sexual orientation gender deserve to be treat see a equal it s 2022 people time to grow tfumy sincere apology if i ve hurt anyone w tweet i m aim for the ignorant bag s that win t accept the truth,0
202331,en,as far a i understand it queer something be about deliberately do it badly in order to highlight it inadequacy i don t think that s fair on wittgenstein also i suspect his social background be at least as important a his sexual orientation,0
202332,en,when it come intersex it s a term i grow to use not one i be bear comfortable with someone may have a similar diagnosis to me and not use that terminology intersex be not strictly relate to sexual orientation or gender identity either it s about sex characteristic,0
202333,en,world a hack group on tuesday release data from an israeli dating website that disclose user sexual orientation and status,0
202334,en,see i imagine a future where neighbor aren t segregate by the color of ur skin or gender or sexual orientation or generation of arbitrary racist policy but by the internal network architecture of the new neighborhood,0
202335,en,same way sexual orientation be it can change on it own but can not be change intentionally through any current method and attempt to do so have prove to be extremely harmful,0
202336,en,they pick people for their skin color sexual orientation or political affiliation competency sad,0
202337,en,your not allow to discriminate against anyone for their race religion or sexual orientation but it s ok for the government to discriminate against the vaccinated and unvaccinated crazy,0
202338,en,all israeli citizen have equal right regardless of race religion ethnicity gender sexual orientation,0
202339,en,when bully use a sexual orientation insult they re not say that they think you re gay and you should be insult for no reason a there s nothing wrong with be gay they re say you should be insult because they think be gay be a bad thing 6 15,0
202340,en,im literally asexual it not that serious it about want sex or not theres no oppression there unless there also intersectionality with sexual orientation or race or gender,0
202341,en,he a grown as man why tf do he care about another grown man s sexuality bro kinda sus,0
202343,en,spent a great portion of my life struggle with try to be cis and hat whenever someone comment on me look act like a boy when i wasn t fem present enough for them it wasn t until last year that i realize i be non binary after tune into gender sexuality,0
202344,en,whatever you feel no matter what be your sexuality you will always be my precious and beloved friend you re valid and amazing,0
202345,en,ah okay so you re try to frame homophobic hate speech a a difference of opinion free clue for you and all the other dimwit who think that s a valid tactic you don t get to disagree with someone s sexuality or their race or sex this isn t a topic for debate,0
202346,en,if you see me be horny on the tl i don t care cause i have a healthy relationship with my sexuality,0
202347,en,what s the sexuality where you re attract to men but you hate have sex worth them and you need to be dominate them in all aspect of life,0
202349,en,gross really who would possibly ask their professor about their sexuality,0
202350,en,let me clarify i couldn t give less of a fuck what hunters actual sexuality be consider it s not my business but it s upset to see someone label themself a a lesbian and capitalize off of that while not actually be a lesbian if that make sense idk just spitballing,0
202351,en,haha there it be a lack of self awareness reveals itself if you thing i be misogynistic a someone who love woman and doesn t care which sexuality your be but fail to comprehend live life in a virtual world when what we have be truly amazing gn,0
202352,en,this man s entire fucking quest be about him be gay tevinter society and in turn halward s specific problem with dorian be that he win t be involve with or even marry a woman of all the npc in dai he be the one whose sexuality should absolutely not be fuck with,0
202354,en,steal this from what be we 10 moots10 we ve interacted10 we ve dmed10 you ve see my face 10 heard my voice10 have my other socials10 know my sexuality10 know my age10 know my country10 gc together,0
202355,en,bradley be truly one of the first tv character i ve see myself reflect in in a real way other than superficially so my investment be a little biased of course but it be such an incredibly important complexity to portray period moreso in someone explore sexuality,0
202356,en,track one s menstrual cycle and i mean track like figure out when you ovulate etc be unironically an empowering way for woman to take charge of their own sexuality,0
202357,en,leading scientist who actually study human sexuality believe be transgender be the result of brain nervous system intersexuality there be no doubt of there be a biological connection,0
202358,en,down to check my cock wasn t be too prominent then laugh take your hand to walk side by side back to concierge and jermaine who seem very amused i didn t know what the general consensus be among staff about my sexuality i m sure it have be a topic at some but i,0
202359,en,the way people be try to meddle amp make conspiracy about h s love life amp sexuality be rlly weird to me why be her romantic personal life so important to people it literally doesn t affect u at all lol whether she see it be bother by it or not isn t the problem either,0
202361,en,i get a new shirt at work at it be the bad material ever,0
202362,en,yo it shirt he give new york be funny,0
202363,en,the peds shelf be just internal medicine wear a poorly fitting kid shirt and i m tire of pretend it s not,0
202364,en,tom take a deep breathe loosen up your shirt that s one size too small,0
202365,en,i think he wear a black shirt lol i don t remember but i think,0
202366,en,somethin about the big t shirt no pant combo feel so good so right,0
202367,en,last year my t shirt be cover in blood yea i use to sit in nosebleed,0
202368,en,tulsa scanner hit amp run fat mexican male wear a white shirt flee on foot request a perimeter amp a k9 be the helo up nope ha,0
202369,en,from this long haired buff and chisel on a crisp white shirt that have too many unbuttoned button but still not enough skin expose taec they should have just unbutton his shirt,0
202370,en,pavard s first ever great game in a bayern shirt in an important game a timely one,0
202371,en,week as well so if you pay domestic shipping after thursday night i win t be able to make the label until next week but i m hop to have it package and ready i ll be get up the form for the jp shirt hopefully tomorrow a well,0
202372,en,yessssss when the planet be align i will own that shirt,0
202373,en,no gifs but a funny tee shirt in the window at provincetown,0
202374,en,oh it be so bad tweens rescue their navy seal father from a nk prison camp almost get shot down by u jet but be save at the last second because one of them be wear a bruce springsteen shirt i have not make a word of that up,0
202375,en,jimin in a white button up shirt always and will forever hit different,0
202376,en,yes sometimes the button just wan na pop like lem me wear this shirt in peace,0
202377,en,my brother in law hat the cowboy and lose a bet now he have to wear a dallas cowboys shirt lmao how bout dem cowboy,0
202378,en,who say you can t wear a grammar lesson my student love my shirt,0
202379,en,sure wish instagram didn t crop my picture so the full radness of my shirt could be behold,0
202380,en,emerald forest t shirt by the mountain,0
202381,en,haha so if your dad s car need to be wash after every 5days that s when you could bag the money,0
202383,en,yes jesus be famous for tell people to f off,0
202384,en,epitome of skank quid pro quo for position and advancement,0
202385,en,some pic from the bad guy club 6 this year hell shriner pest bone head and space skank,0
202386,en,belated born day blessing to the uk gh legend lethal bizzle np fester skank prod by diztortion on theall abroad a list w yfm,0
202387,en,my ex boyfriend from high school decide his new thing be to message me on snapchat every other day and call me a skank prove yet again i really go for some winner,3
202388,en,just drop off your electrical good and voluminous evidence and go skank,0
202389,en,nobody call my skank a skank this bar fight be awesome,0
202392,en,you call me a skank yet be tell me to grow up your priority be wrong that shitty bedsit no boyfriend and no car have make you a bitter old woman,1
202393,en,i d have to see em myself 1st to tell if you re a skank or not other than that that clown,1
202394,en,omg wtf be wrong with u youre just a horrible batch that s must be the reason you marry a pedophile dum as skank,1
202395,en,damn rockefeller skank be a bop forgot about that song until it play at work,0
202398,en,you just describe donald trump you skank dumbass trumpanzees like you need to be deprogrammed or de something,1
202399,en,this be not acceptable,0
202400,en,obvs that s not why i do it i m just a lazy skank,0
202401,en,always the victim but your mum be a slag,1
202402,en,london slag party,0
202404,en,check out this listing i just add to my closet vintage le smith bittersweet slag glass bowl pedestal candy dish compote orange,0
202405,en,all up for banter but this chat about gvb and maloney about be small be absolutely tragic see grow men and woman slag their height that s all new level of fuck weird man,0
202406,en,people who mostly on here say someone else s opinion on football matter be clueless and slag them off for it be sad imo come up with a educated reason why you disagree with that person have a debate slag them off isn t very clever,0
202408,en,on lbc to slag off boris johnson for 3 hoursmeanwhile keir starmer plan to get labour mp to support boris in the common votewhy be tory mp the only serious opposition,0
202409,en,it be literal fucking garbage i know there s a propensity to slag something off when you re on the oppose side of it but honestly that be one of the bad thing i ve ever read masqurading a a serious piece,0
202410,en,i m not that kind of person to slag people off behind a keyboard but what a pathetic clown and wimp you be you can t even keep your word this be your insurance bc you ve get to be see do something if shit hit the fan when it s crystal clear these measure ain t work,0
202411,en,come hear gav and helen slag off coldplay this week on list of list,0
202412,en,well that find kind of put my meagre slag to shame,0
202413,en,i work in coal fire plant 32 year there be no way to burn coal cleanly none it can not be do anyone who pretend otherwise be lie just the slag the remains end up in ocean and river and air and that s only a small part of it,0
202414,en,end of season 2 round up otis be a slag and i hate ola aimee eric and maeve be faves,0
202417,en,at 16 he s get his parent his representation all adult be heavily influence his decision no decision that big at 16 be 100 him i wish he d stay but im never go to slag off a kid,0
202418,en,big slag of a spicy ruby to blow the remnant of this omi out the window and it s back to lick bannister in town,0
202419,en,social medium fan can t wait to slag off their own after a defeat,0
202420,en,mod honestly fuck off the man s score the equaliser today but all you can do be slag him off from dubai why don t you cut him so slack you fuck hypocrite muppet be my only word for you,0
202421,en,i can t see this meme anymore it s piss me off i want to slap them,0
202422,en,i tell y all every time i think i find sb god slap me with his sandles,0
202423,en,nah a boogie artist album still slap so brazy,0
202425,en,be it a drawing of your red faced slap head after be boot out due to unethical coercion of nhs employee and care worker over no jab no job policy,0
202426,en,open smartnews and read ohio school warn parent about slap a teacher tiktok challenge here to read it on the web tap here,0
202427,en,i go back and forth between i d let him slap me again and okay imma pull his hair so hard he s go bald forever,0
202428,en,bull it hasn t be a slap and you already delete the tweet about him not do anything with the swift system i can t believe you have fan,0
202429,en,okay these all slap but your kill me with dunsparce granny she must be protect at all cost,0
202430,en,that new tool pretty slap ngl,0
202431,en,ash moan a her ball slap widow groan a little nervously see mercy move in closer uhh what ya do,0
202432,en,i need someone to professionaly slap me and tell me i m a piece of shit when i procrastinate,0
202433,en,can t believe i m say this but the new reese s peanut butter cup with the potato chip bits kinda slap,0
202434,en,gqp cultist just misbehavin slap him silly,0
202435,en,not a huge fan of a good bit of p4 s soundtrack s but god do the bos theme slap,0
202438,en,oh my god epic make an example out of me instead of a slap on the wrist,0
202439,en,ring ding dong gon na slap jonghyun hit that autotune right at the bust,0
202440,en,jack black a bowser this movie be gon na slap,0
202441,en,the fact that my pet name be purposely stupid knee slapper lmaooc mon here lil ben,0
202442,en,me wan na hear a knee slapper me my life,0
202443,en,i can t believe i ve never hear this absolute slapper,0
202444,en,if you ve finish go after the cruel horse slapper how about you take these folk on that i d like to see,0
202445,en,whoohahaha that s a knee slapper that might never get old who know manchin be a comedian,0
202446,en,another knee slapper from twat baio,0
202447,en,i can t lie lil top and da baby get ta a slapper on their hand i m rey mosh,0
202448,en,damn we re out the gate with an absolute slapper with an act of this caliber sign on early the other band be gon na flock to the event now just watch,0
202449,en,me anytime i discover a new slapper,0
202450,en,it s a new title by yacht club and it look like an absolute slapper you can wishlist on steam can also contribute to the kickstarter if you re feel generous,0
202452,en,asta everyone out of the way as slapper be here don t let him pinch your butt asta,1
202454,en,this be a good onea real knee slapper,0
202455,en,other than piss aucklanders off what be the point of yesterday no message be communicate other than look at me i be world famous on facebook should have get that slapper up from wgtn and she could have walk over naked that would have get some attention,1
202456,en,tough shot for you to face wrister snapper or slapper,0
202458,en,sadly doesn t mean anything courtois be a habitual chest slapper,0
202459,en,the grid be good another knee slapper,0
202460,en,demographic decline be quite the knee slapper,0
202463,en,just ur friendly neighbourhood emo femboy 10 for more from this set,0
202465,en,i need to be drag into a dark alley and fuck like a slut,1
202466,en,this song make me feel like a slut and i like it,0
202467,en,if britney s a catholic slut i m also a catholic slut,0
202469,en,ull get lotta of slut shaming and for nth,2
202470,en,yooooooo mmyyyy it be like see a fantasy of a very macho man become a sweet princess who be really a fucking slut thanks for how you share,1
202472,en,kim petras treat me like a slut official visualizer via,1
202473,en,hello it me radabots a slut for a great musical score uwu,0
202475,en,that wasn t say to stop so guess you re love them she smirk and give one more this time keep her hand on the girl s rear and grope it,3
202477,en,stop shoot amateur porn on it save some space you slut,1
202478,en,i can t believe i post this and spend my entire bus ride to work slut sham him and i have completely forget about this most holy of day it still count a celebrate if it wasn t originally plan that way right,0
202480,en,you lie like hell you always take your shirt off every 5 min for what you slut monkey,0
202481,en,i love drain my little slutbag it s his first game,1
202483,en,right now my body be merely a vector for the rona a finely tuned vehicle for airborne contagion a big ol slutbag for omicron,0
202485,en,i want to slide your panty over and insert my penis and breed you and ejaculate inside you make you a slutbag whore,1
202489,en,update 11 9 2021 amp,1
202490,en,i m gon na powerwash your couch slutbag,1
