id_EXIST,lang,tweet,label
201545,en,perfect a lady whose forefather once be and get forcely convert get bitten amp bruise by the very big0ted ideology aka religi0n yet appropriate the essentiality of be from the abr to be a perfect indian,0
201546,en,it s time for policy base on evidence not on ideology outcome of our current drug policy via,0
201547,en,you know this be vapid nonsense nonsense when china have hundred of fuck billionaire and significant wealth disparity problem your entire ideology be premise on anti u contrarianism,0
201548,en,his ideology be state of madinah his ideology be justice his ideology be anti corruption his ideology be to tackle the poverty and hunger and full fill the need of poor people his ideology be one educational system for all citizen of pakistan his ideology be welfare state,0
201549,en,i object true anarchist have a political and philosophical ideology these people be just cretin and grifter and fascist,0
201550,en,sigh it s easier to believe in lizard people instead of come to the realization that their ideology just prop up monied interest exploitation of misguided rage,0
201551,en,i be beg you to stop call thing california ideology when they be not,0
201552,en,yeah the immerwahr piece be much more in depth about the actual culture and political ideology surround the series and also uh talk about my bos bos bos a lot,0
201553,en,watch various scientist on twitter be awaken to bias in science have be interest science have always be bias the bias be bad now but the idea that science somehow transcend ideology be evidence of it ideological power,0
201554,en,oh man that s brilliant it s such a basic thing to understand that human be notorious for not act in their best interest but a steady diet of capitalist ideology prevents so many from understand this,0
201555,en,mmt serve a a powerful analogue for the trans struggle against what could be call sound gender ideology the assertion of a strictly material gender reality that the introduction of new pronoun can only debase,0
201556,en,it s their term the woke come up with it the perjorative use of it be make fun of the term as much a it be a criticism of the ideology,0
201557,en,there be no ideology you just hate trans people and if you can t accept a child be trans then don t dare talk about kid cause you re no good than the loser garbage who can t accept have a gay kid,0
201558,en,transgenderism and sexual orientation be not the same thing i be gay and i do not support sexualize child or gender ideology,0
201559,en,not thro coal mining steel industry gas bt or most large manufacturing firm because you be part of the thatcher major government that either shut them down for anti union ideology or sell them for you and your mate to make vast profit at our expense,0
201560,en,erens anger be so justified the founding titan ideology be insane,0
201563,en,so the gop be so pro life they don t want people to have abortion so they be go to kill woman instead when be people go to realize this be all about control woman and never have be about protect life or fetus or baby or any of it,3
201564,en,israel we stand with ukraine stand with humanity rusia bla bla bla meanwhile them terrorist colonizer apartheid system kill more than a million palestinian bomb them kill woman kid baby amp men who don t hold any weapon,0
201568,en,can not get the death of out of my mind my cousin rosie be murder some year ago and it have bring back a lot of memory not all men kill woman but one woman murder have too many men involve,3
201575,en,do you believe that men kill woman rapidly in this country and rape them every day,3
201577,en,overturn roe v wade win t stop abortion it will only stop safe abortion this win t save baby it will kill woman,0
201578,en,black terrorist hate amp kill woman your move,3
201580,en,woman be outrage by the much light sentence give to men who may not even claim to have be nag for any length of time and to men who kill woman during sex and claim that it be what she want,0
201581,en,we really need more positive male role model in mainstream medium who don t have laddish and outlandish craic attitude to everyday life and that s without touch on the culture war of give popular influencers drive time show on radio station,0
201582,en,amadour see florida at the moment i m feel sort of like a laddish observation,0
201583,en,army laddish culture comment a mistake gen sir nick carter say,0
201584,en,must be my bad head i forget how much you love rugby and laddish town centre bar,0
201585,en,there isn t imo a natural laddish nickname for graham and that s important dean smith can too easily be know a deano,0
201586,en,pink be for someone who despise bigotry and misogyny pink be for the empowered pink be for leni the hue be ideal for her who have always be the face of opposition to all laddish authoritarian,0
201587,en,trivialise crime be your thing now iain how about i be only just over the limit your honour or i only nick him with my knife officer the laddish image have slip for and you client puppet be struggle with defend the indefensible why do this,0
201588,en,it s odd that somebody like baddiel who have in the past black up on tv publicly praise misogynistic comedy and be at the forefront of the dreadful reactionary laddish culture be now hold up a a progressive who can teach u liberal value,2
201589,en,arm force head general sir nick carter defend laddish culture a world in the hand of,0
201590,en,another laddish joke,0
201591,en,football be the only laddish thing i ve ever be into and even then probably because i be so into memorise stats when i be a kid it fascinate me nowadays more for the human drama and psychology involve than anything else,0
201592,en,for real i mean not a part of some sort of laddish ruse,0
201593,en,hell but i open up the late 90 leary s psychedelic utopianism seem that orchestrate not less laddish than simply cut,0
201594,en,rod stewart apparently sing for a carol service for the first time since he be 7 my goodness he s still get it that heart break huskiness and the dishevelled laddish sexiness mass raise for,0
201595,en,football use to be more than mere entertainment like strictly or i m a celebrity it use to be a celebration of ladness when it wasn t bad to be laddish and now it s about something alien to a male celebration of sport endeavour and camaraderie,0
201597,en,oasis be ok but they weren t very original they just have more front amp well clobber amp trainer than some of their predecessor i agree they revel in a narrow cliched tabloid view of what be work class be about boorish punchy piss up coke up laddish etc etc,0
201598,en,now this be laddish chant i can get behind,0
201600,en,do i have to be a loud obnoxious laddish bloke to get notice or will the right woman actually come along without warn do you reckon answer on a postcard please,1
201602,en,if i m drive and you ladies don t do this to me i ll chase you out of my car,1
201604,en,like the lady don t want it like they don t enjoy it more we be always funny they should come out with their full chest and ask for payment for have sex co those who do that actually get pay,2
201606,en,he take it to far the lady don t even go this long,1
201608,en,men the death of lion can t be announce by a goat and if a goat dare to then it ought be slaughter in feast to honor the dead lion i mean focus on hustle bro this ladies don t post break men have you ever see me on someone s status focus,1
201610,en,lady don t let these dude touch your face in the club they don t wash their hand,0
201615,en,lady don t be a boring girlfriend take him to the motuary and show him the space you have reserve for him if he break your heart,0
201616,en,lady don t let you be a lady deceive you that you ain t get ta take care of yourself we observe and pick the clean one among you mind you i didn t say pure who even be aye,1
201617,en,sadly so many lady don t want him to in the first place,0
201618,en,a a man you can t claim to be a breast lover yet you be know for break the heart of busty lady don t bite the nipple that feed you,1
201622,en,the lil click clack on the phone screen make me feel like a lady,1
201624,en,i mean if we re be adult one of them have hair that look like a lady toy,0
201625,en,dude look like a lady absolutely classic film,0
201627,en,karaoke version 2021 celine dion treat her like a lady,0
201628,en,after finish book i rate it 10 10 in which i highly recommend and now i will begin read act like a lady think like a man,0
201629,en,not a fan of excessive sweetness also can t be smell like a lady problem with those blue perfs you mention be that they have mostly be reformulate after thier release make latter batch weaker or with less projection,1
201633,en,my mama tell me treat er like a lady my dawgs tell me treat er like a thot,1
201634,en,now play treat her like a lady single version by the temptation,0
201636,en,now play the temptation treat her like a lady listen live,0
201637,en,dude do not look like a lady,1
201638,en,act like a lady think like a man,1
201640,en,dude look like a lady woman should be so proud of be out maneuver by a man,1
201641,en,oh what the helli think the woman that live above u be sing but the sound feel like be come from my room and to be honest it doesn t even sound like a woman s voiceit sound more like a little girl s,0
201642,en,man i feel like a womani vote for for of 2021,0
201643,en,this she be definitively a man a man body a man strength it be totally unfair to woman to compete with this faux woman she can dress like a woman live like one etcetctec no competition for transgender,1
201644,en,uo 12 let me you like a woman be lana s alltime bad song,0
201645,en,woman like me like a woman like me lalalala woman like me like a woman like woman,0
201646,en,i can not believe how utterly emotionally drain i be from a john carpenter movie about an alien who look like a woman s dead husband probably his most magical movie that doesn t involve people s skin fall off their face he s never do something like starman again,0
201648,en,yes i do just wish the poster say fight like a woman a the language of girl continue to infantilise them,3
201649,en,there s no way to sum up our experience up in a tweet but i think i understand fairly well my mother aunt cousins do a number on my mental health i m try my best to untangle the mess but i still feel like a woman dislike by woman online backstabbing doen t help,0
201650,en,finish my book today which be quit like a woman by holly whitaker and i highly it recommend to anyone try to break a habit or start anew and anyway this be hit currently,0
201653,en,man of integrity more like a woman scorn,1
201655,en,they have to earn you smell like a woman instead of an ape,1
201657,en,man think moan will win him the title move like a woman,2
201660,en,ayleen say hell hath no fury like a woman scorn,0
201661,en,mansplaining be literally just how intelligent men talk bro,1
201665,en,kinda sound like you re mansplaining law to a lawyer,0
201667,en,the best way to prevent yourself from mansplaining be to know absolutely nothing about anything just be dumb a hell head empty,1
201668,en,this bitch be mansplaining christine to me bitch ive grow up on horror,0
201669,en,ah ok guess we re add mansplaining to the list of thing you don t understand and yes they factually do to claim otherwise be well both dim but also kinda predictable,0
201671,en,toxic masculinity doesn t exist that s a bullshit make up term and so be mansplaining so please save it,0
201681,en,i d like to file a complaint for an outrageous display of manspreading in a public area,0
201683,en,it s not a jackson wang photoshoot without him manspreading,0
201684,en,if you look at it just from a body language perspective he s not wrong but manspreading be just be a asshole,0
201686,en,think about blake manspreading on a throne and the world be close in on me,0
201687,en,have a similar experience last week i be press up against the window as small a i could possibly make myself and the guy sit next to me on the bus be manspreading so that our leg and shoulder be touch in a pandemic i want to scream,3
201688,en,not jelly write while manspreading to jupiter come on dude,0
201691,en,man manspreading beside megan thee,0
201693,en,me whenever taehyung manspreading on a chair ooh what s happen,0
201694,en,i m thinking of a roommate who just leave their stuff everywhere and just take over the space even though there be suppose to be others use it bc that s what manspreading do hahahaha,0
201695,en,nobody s ever talk louder that the men stand behind me right now it s like manspreading but voice,0
201696,en,i love both but him manspreading be go to be my death,0
201697,en,jeonghan messy hair in that fit manspreading a spicy sizzle very hot man,0
201699,en,jimin cross his leg and taehyung manspreading ohmylord,0
201700,en,dude be sit manspreading with his foot block my way and get baby rag when i be stand and walk to get off at my station and my shoe tap his once,3
201701,en,i think what it mean be precisely that we can learn through fiction song play and that a singleminded focus on debate and rigour a source of knowledge have a history of be use to marginalize some of those way of learning and create a monopoly on intellectualism,0
201702,en,anytime i hear about layoff at game company i just assume it be so some vp could get a big bonus why get rid of qa or even marginalize it do you want your game to be shit,0
201703,en,encourage and nurture your child to grow a thinker and then marginalize them when they don t follow the common narrative,0
201704,en,i ll give you phil murphy he kill thousand of senior and say the ukraine attack be our bad nightmare which sure do seem to marginalize what the ukrainian be go through from 5k mile away,0
201705,en,the talk point be that democrat continue to marginalize mexican american ie over 13 5 of the u population,0
201706,en,marginalize sector ang laborer and part si ka leody dun hindi siya political elite katulad ng ibang candidate let s not marginalize them far with petty exchange like this let s be good than this,0
201707,en,how do i marginalize them the vax be available if you want it get it if you want to shelter yourself do it the vax do not prevent the spread so at this point do you want everyone lockdown again i m confuse a to what your solution be,0
201708,en,one of the first time i remember watch him he argue that when the government prevent him from exercise his god give right to marginalize and ostracize non believer it be government tyranny,0
201709,en,crt be a theory that policy and law be write to marginalize one race you oppose that,0
201710,en,vk be bit late in give up white ball captaincy should have do it much earlier need to give up 50 over captaincy too rohit shouldn t accept only t20 captaincy that ll marginalize him a skipper amp put doubt in the mind of youngster in the team with 2 power center,0
201711,en,once you marginalize the less fortunate these act become evermore prominent refugee of all race become target,0
201712,en,the sadrist bloc marginalize the losing party in the election and be prepare for the next stage in coordination with the winning force,0
201713,en,what need to be disseminate instead be the fact that think those who speak of electromagnetic attack audio voice transmission remote neural monitoring etc be delusional be ignorance and society be be condition to stay in ignorance amp to marginalize people like carl,0
201714,en,so glad i m not the only one i m just disgust how they marginalize steve s character a loyal dedicated guy a bore annoy etc she s never happy it s not enough amp i don t like che s character either i don t like any of this storyline i fastforward just like that,0
201715,en,this be not only a gender issue but a class and race issue any unfair law that marginalize woman will no doubt impact black girl and woman even more we need to talk about this,2
201716,en,thanks to zillow and hedge fund and our long work a a country to marginalize the poor home ownership be not something feasible for young people or anyone without either a corporate job or family money edit five young people plus u divorced people in our 40,0
201717,en,that s how they marginalize cannabis also,0
201718,en,pelosi need to marginalize the squad no committee assignments no influence,0
201720,en,4 area be relate to intersectionalitydo we know our privilege when we walk into a room do we know how our privilege and power may oppress or marginalize others,0
201721,en,brb have to go masturbate now,1
201722,en,a dom watch their sub masturbate just sit back amp enjoy the view the sub be fluster be intently watch like this when the dom start touch themselves too the sub be so so eager to touch but be challenge to just sit still like sir madame be able to,0
201723,en,masturbate no one else then just me okay then,0
201724,en,full length bg vids on my of,0
201725,en,the adolescent urge to anxiously masturbate late at night while everyone else be sleep when on my old family computer at my parent house,0
201726,en,this ohoo moment to masturbate kill me shey if we see people smile or talk person go start to dey masturbate abi wetin,0
201727,en,who want to play i m horny,1
201728,en,man feel free to masturbate in public because of,0
201730,en,between masturbate to porn or fuck a communist the less evil be to masturbate to porn because porn will only drain your heart communist will drain your wallet and pantry,0
201732,en,make content aka a reason to masturbate in front of other people s houseplant,0
201734,en,how come there be rich people who masturbate,0
201735,en,if woman have no right to get rid of a clump of cell with no sentience no self awareness can barely be call alive then men should have no right to masturbate men kill billion of live cell daily and yet it be only wrong when a woman do it that make no sense to me,2
201738,en,penis feeling so good this afternoon a slow long tease edge session so far just make love to penis give him whatever he want,0
201740,en,you have to be horny if your up this late you might as well masturbate with these free video,1
201741,en,ooh ooh i get it my new year resolution be to stop resist the urge to impose my own metanarrative onto everyone i meet i m just gon na give into it and succumb to my own fictional internal universe,0
201742,en,the world will need an ample dose of meta psychoanalysis to survive the metanarratives of the metaverse universe,0
201743,en,in meeting i d always be sure to keep a window open so i could get your twitter metanarrative,0
201744,en,i think he s try to be clever metadata be data that provide information about the data but be not part of it metanarrative be therefore narrative that provide information about the narrative without be part of it read between the line to you amp me,0
201745,en,there be many more example of this but the point be there s more than enough to interpret the player a a part of deltarune and it story and part of a large metanarrative on player vs the character we control it s not just baseless,0
201746,en,i love everything about this i want to use this along with a few other thing i ve be put together my metanarrative villain just get a wicked new mechanic thanks,0
201747,en,why would any of them ever change in a changing room instead of their own bedroom where they actually keep their clothes so that they can reaffirm bond s gender and provide metanarrative commentary about real world trans discrimination that s why,0
201748,en,sunset boulevard masterpiece phenomenal screenplay and i love the metanarrative with gloria swanson s career really shock a film like this come out of studio era hollywood,0
201749,en,what we all need be nuclear it win t be allow to happen it would kill the highly lucrative politically expedient metanarrative of climate emergency instead cynically it be problematised out of the run it s utterly despicable,0
201750,en,asuka in those movie fit the metanarrative theming of the character be what the real world public want them to be but it definitely make her a bad character but it s sorta the point,0
201751,en,leapableio first ido 50 off the pre sale for tier owner there will be a special airdrop bonus for those who buy and never sell token until ido date the new ido will do at least 10x let s join now,0
201752,en,this be honestly why i don t even bother share complicate perspective on here people be so obsessively fixate on metanarrative and create dichotomy and in the world of sociology and the humanity binary be often completely smash,0
201753,en,you d know good than me this be just whose metanarrative i find more convincing,0
201754,en,a simulacrum posing a the new metanarrative of history a resuscitation of the belief in transcendental category of good and evil it do not describe but inscribe it do not interpret but axiomatizes,0
201755,en,i m sit here on the outside of the faith and i can see it clear a day a racist and regressive conspiracy theory from the far left have essentially become a fully articulate metanarrative that form the foundation of a new religion,0
201756,en,it s possible it s a semantic dispute but also possible there s a hidden assumption to the effect that the meta in metanarrative necessarily hegemony or aspiration to hegemony i don t see why that must be true,0
201757,en,in particular in the article of mine i think have link i sketch out how both a certain sort of feminist and a certain sort of misogynist really really want to believe in a metanarrative of warlike patriarchal indo europeans with warlike patriarchal sky god,0
201758,en,the french dispatch look it be fine but it s basically three short film that don t hang together a a cohesive metanarrative and also it turn out wes anderson in small concentrated dos doesn t work quite as well,0
201759,en,a write most moral admonition to student do not follow the pattern of how god morally motivate his people throughout the biblical metanarrative perry glanzernew post by perry glanzer professor at,0
201760,en,every political cosmology metanarrative now suffer from the same fate a christianity instead of jesus actually come back people just repeat that jesus be go to come back ad infinitum,0
201761,en,misandry doesnt exist but if we work enough we can make it real,0
201763,en,he have no idea what he have say wrong,0
201765,en,this society really manage to make u believe that be call a feminist be a shame we need more misandry cause patriarchy win t go away by cuddle men,2
201766,en,i get sent flower today and it s make me rethink misandry,0
201769,en,agree tbh though i d emphasise the extreme part i don t think casual misandry be necessarily a problem i often think about how annoying men be or how most of the men i seem to interact with be like 12 year old boy who never grow up,0
201771,en,misandry lead to think crime and mean comment,0
201773,en,everytime i see misandry i start to laugh,1
201775,en,they don t even know what feminism be think feminism misandry lmao,1
201776,en,yes it s possible u may not know the term of misogyny or feminism but it s possible your feminism or misogyny or even misandry can start as little a 7years,0
201777,en,like i feel like people see some injustice men face an go it must be the same a misogyny but no misogyny be systemic whereas misandry be societal like they re entirely different,0
201779,en,why be you a a man like sad quote what else bother you other than misandry,0
201781,en,the big set up back for most woman be the loser they decide to fuck and become emotionally attach to,1
201782,en,once your uterus go down but they don t tell most woman that it take 6 week for the uterus to go back down to it normal size,0
201785,en,it amaze me how many men guy can not hold a wholesome genuine conversation with their gf wife most woman be only look and offer nothing else can t cook can t dresscan t think real woman be a die breed,1
201788,en,well no one seem to know if bowie be still wear his collar and at one point i speculate the killer might have take a piece of jewelry but when i read the autopsy again i notice something be miss something most woman probably wear,0
201791,en,load of as and tit but unfortunately like most woman no brain to go with it,1
201793,en,again not really beyond it be really easy for a woman to divorce her husband the only woman who would have realistically have any power be widow of landowner most woman have the same shit position they have elsewhere in medieval europe,3
201794,en,i mean most woman on blood moon have a half mask or they have the mask on the side of the head,0
201795,en,poo poo most woman don t bite you can pretty much tell which one s do just by watch them a few minute go for it you may be miss the best time of your life,1
201796,en,if most woman lift black men up like you do your husband the black would be good salute to you and your husband and family,0
201797,en,8 10 2021 why most woman will never be upgraded via,1
201799,en,i m not the one pretending to speak for woman i m simply observe that accord to the best data available your view don t represent most woman this issue isn t about woman it s two men talk one of whom be use woman to justify his hatred of a minority,0
201801,en,i don t know what it be about get my chore do before 2pm that make me feel like i don t need a man on a sunday but i m here for it,0
201804,en,i need a man i love fish shirt id wear this,0
201805,en,so we all get this sick little voice in our head tell u we need a man like joe goldberg,0
201807,en,i don t need a lawyer i need a man if he happen to be a lawyer,0
201810,en,kinda need a man like this,0
201812,en,perhaps you need a man who love you sincerely for yourself and your temple and to live with you happily and fun and not for a personal or commercial matter it me,0
