id_EXIST,lang,tweet,label
200002,en,write a uni essay in my local pub with a coffee random old man keep ask me drunk question when i m try to concentrate amp end with good luck but you ll just end up get married and not use it anyway be alive and well,3
200006,en,accord to a customer i have plenty of time to go spent the stirling coin he want to pay me with in derry just like any other woman i m sure of it in retail,3
200008,en,new to the shelf this week look forward to read these book,0
200010,en,i guess that s fairly normal for a neanderthal,0
200011,en,mean woman usually end up in low paid support work when that start to change traditionalist notice unfairness that previously hasn t bother them at all,2
200016,en,the woman will all be at home cooking for the family,1
200019,en,sorry my feminist rage at the old white man praise the two female woman of colour and elite fucking athlete on their smile do roger federer get told nice arse when he win,3
200020,en,why do we create comic about sexism in science it s not just because we have a lot of spare time or like to doodle check out our blog post for,2
200022,en,in other word the game journo industry who basically know the entire time be complicit that can t be right it s get ta be something to do with the misogynistic gamergate boogeyman,2
200023,en,he s really shit on game journalist from what i remember start at the tail end of gamergate he s clown on developer that use unity in the past it s honestly be awhile since i ve close follow it hard to pick out specific example,0
200024,en,low key she be fr create because the incredible hulk tv show gon na do it first and marvel want them right but these gamergate dude need to stop,0
200025,en,one of the most important and of course undervalue piece ever publish on combat white supremacy and fascism,0
200026,en,it s especially weird because the alt right on youtube be old than breadtube which be a reaction to rw gamergate content,0
200027,en,well they re kind of shoot themselves in the foot by inject political drivel into entertainment by push stress into escapism you impassion people by strip them of their release thus spawn movement like gamergate comicsgate etc people push back c,0
200028,en,i don t even know who tf they be only know they be part of the whole gamergate shitstorm back in 2015,0
200029,en,a a person who live through gamergate these new generation incels bitch about aloy s peachfuzz be not what i or my hairy russian futanari with shit dick nipple hentai addict brother be fight for give aloy a beard and a huge cock,1
200030,en,anita a an asset damn i should ve consider that her v gamergate be one big spectacle,1
200031,en,i want to get off 2014i want to get off gamergate s wild ride,0
200033,en,the dummy who try bring back gamergate be spend his time off from wait table pretend to know stuff,0
200034,en,they still try to grift that gamergate money aren t they this be what i call terminally online,0
200037,en,it will just talk about game without bring twitter drama and gamergate bullshit into it any more but i use to love jan garbarek a a kid,0
200038,en,the russian bot be monitor the situation involve gamergate,0
200039,en,it be amaze and i know that anyone who might have be hesitant immediately fell in love with you when we start discuss gamergate,0
200040,en,you have rage issue that manifest in an internet addiction it at least started outwardly during gamergate and when that die you need a new fix you already have your view on trans people but we become the new vessel for your anger you need help,0
200044,en,bro you just harass him,0
200045,en,no two completely different situation teacher have break up the fight it be over simpkins go to his bag pull out his handgun and fire simpkins claim he be be harass but the police have state this be gang relate so good try but no dice,0
200046,en,wheel of time get a trailer release for amazon that look horrible go in to try and soften the blow get downvoted and harass by them for say it look like a cw show lol,0
200048,en,a serious hardcore groupie who ja invite to the ecuador embassy stalk harass and bully journalist and member of the public who be critical of ja go rogue after trump election and leak a huge trove of chat log to micah lee at the intercept,0
200053,en,anyway a i say up this thread be for the handful of ppl that follow me that will care for everyone else you can do say whatever about me i really don t care anymore too many good ppl have be harass or felt the need to leave bcuz of this fandom i win t let them get to me,0
200054,en,this poor waiter be harass by six 30 something woman i feel bad for him,0
200056,en,who harass the news team the cop or the protester,0
200057,en,i understand you re try to be nice and stuff i hope you give that block button more love because it s a tool that help make you more comfortable on social medium and enjoy not be harass or see content you don t like,0
200059,en,journalist continue to be attack and harass by the taliban their late victim be qais,0
200060,en,my situation be completely different but i fear seek help because my ex husband stalk harass be still abusive etc and i be scar he would use it a a weapon against me which he do he file a rfo w defamatory allegationsjudge tell him fk off again,3
200064,en,mgtow ka india wing bhi hai kya if yes then they would need more traction baaki pro male andolan ki reach bahut kam hai imo,0
200067,en,950 iqs mom and dad also have no way out these mgtow jp follower do not know what make relationship stable it be not always no way out big reason for stable marriage in previous generation be that they get marry early,0
200068,en,i have to look up mra and mgtow what,0
200070,en,i m have a hard time deal with the pervasiveness of misandry in society see shit like that all the time make check out more and more appealing everyday the way not the suicide way,0
200071,en,international men s day,1
200072,en,some be a key word in mine lol it wasn t a minority and i also didn t generalise them a incels i say that incel and mgtow culture be get close to the black community because they may not be incels but it s a road and their line of thinking could take them there,0
200073,en,be alpha male a movement something like mgtow,0
200074,en,sou base cria redpill mgtow blackpilado frio patrick bateman kanye west drive 2011 blade runner ma tudo isso ironicamente,0
200076,en,i have another article this month this one will be controversial because it deal with mgtow be it hate speech do they hate woman be they dangerous check the answer in this post,3
200079,en,thank you for promote mgtow,0
200082,en,what be your story notallmen a we share ours and you re in them if you don t recognise yourselves then mace and legislation or your tweet tell other men to listen honestly don t matter it start with you what have you and your mate do that you now know be not okay,0
200085,en,it s patriarchal world woman can have no job yet can live on her own not men,1
200086,en,remember the time lewis accuse of not do enough about racism and he come up with a kind of response,0
200088,en,have a penis not all woman have a vaginanot all folk ascribe to the binary,0
200092,en,obviously but sorry the fisher exact test leave no doubt,0
200094,en,notice how civilian men who don t hold any political power in their country keep tweeting we be do this that this isn t cod war isn t a friday night twitch channel you re tweet from home,0
200095,en,be i the only one who read a no tall men not make any deep point here just confuse not an infrequent occurrence,0
200096,en,let s look at your retweets nintendo switchsportsnotallmenwow you re really hit hard on the social commentary how could i keep up stop fronting and just be honest with yourself still figure thing out be the only truthful thing you ve ever say,0
200097,en,need to step up their game because can be trust to keep their own behaviour in check if a schmuck like me can be a decent ish human be for 51 year despite many many instance of not be sober and or in a legal frame of mind you can do it too,0
200098,en,the tag be currently trend in nl i know it s not all men but it be heckin hard to trust men when you ve have men you know as well a random stranger force themselves onto you or touch you without consent just put it out there watch the video below,2
200102,en,an excellent thread on how the patriarchy deform men s soul and damage their life,0
200103,en,okay but what if it be two woman say fuck the patriarchy that would actually be so sexy of them,1
200104,en,you be toss me the car key fuck the patriarchy pee stain on the ground,0
200109,en,blackness be not a shield for men to protect themselves from criticism especially men ignorant of all the patriarchy in non white country female baby be abort in china woman be isolate in menstruation hut breast iron fgm poc know what sex be,3
200115,en,idk it s just different maybe due to ingrained patriarchy or something i use to tell my bm i d love to watch her fuck a girl but another nigga hell nah,1
200116,en,you re not god or my father or my bos ah yes the three gender of the socius a summary of universal history the primitive code of the earth the despotic overcode whose royal incest establish the patriarchy and the civilized capitalist machine,0
200119,en,the whiskey and cigars the 99 dollar seminar the mustache wax the secret societies the we need a patriarchy discourse into the trash it go if you re feel a crisis of manhood then just be handsome and stop talk or at least stop talk like that,0
200120,en,i would be glad to see the violence on twitterng over the next couple of week both patriarchy and misandry fcs be in top form and they be prepared to go nose to nose let s have it,0
200121,en,actionaid conduct a survey on street harassment they find that 79 of woman live in city in india 86 in thailand and 89 in brazil have be subject to harassment or violence in public a have 75 of woman in london uk,3
200122,en,over 400 people use our helpline this year you can donate 10 or more to fund it in 2022 amp help more people,0
200123,en,81 of woman and 43 of men report experience some form of sexual harassment and or assault in their lifetime so it happen and i could be bother look,0
200124,en,explore photo and excerpt from the conversation to learn how activist view advocacy allyship and accountability within the movement and check out on instagram,0
200126,en,thousand of girl and young woman have share their story story of group harassment of violence show they re,3
200127,en,chalk back the girl and youth lead street art movement to by natasha harris harb and sophie sandberg read here,0
200128,en,catcall of college park launch to spread awareness and spur dialogue about a culture of catcall this harassment can have an impact on victim and restricts woman s engagement in civic life every woman have a street story what s yours,3
200130,en,we re speak out against april 3 9 join u by use chalk pro respect message flyering amp speaking to friend about why this issue must end 1 2,0
200131,en,be it s not a compliment it s never okay,3
200132,en,so important for u to take a stand,0
200133,en,however in my experience when we share our unique story and come together a a community we create powerful conversation and cultural change,0
200134,en,have a story of street harassment you d feel comfortable share send u a dm or email u directly at itsnotacomplimentmelbourne com,0
200135,en,1 stop street harassment 2018 study on sexual harassment and assault,0
200136,en,accountability be not a sorry it be action it be deep self reflection and change of behaviour natasha and maya photo by,0
200137,en,i don t know where this be but some state do have law against this sort of behavior,0
200138,en,a man be entirely responsible for his own action,0
200139,en,tw pedophiliajust a few of the story from our chalk event last week show me what those hand can do say to an 11 y o i bet you re so tight i d love to fuck that say to a 9 y oget pedophiles off the street,3
200140,en,be an upstander today and everyday,0
200141,en,what matter be the functioning of the human right theory humanity matter for tigray amp tigreans,0
200142,en,301 day even under the intense pressure of be discriminate against amp try to get his amp all deaf athlete voice heard this fantastic young athlete remind u,0
200143,en,i will not go to school without my sister i support my sister an afghan boy true man wise human who know the sequela of exclude half of society education for all afghan,0
200145,en,sex pistol god save the queen via,0
200146,en,dj n be just a important nonetheless come lock into slimzosrecordings livestream on instagram thursday even from 7pm uk time and i will try to prove my claim,0
200147,en,society s set norm happy men s day though,0
200148,en,there be no place for in this world,0
200149,en,abolish the monarchy via,0
200150,en,with grow demand for the president to resign we get ta wonder when will he learn stop be violent,0
200151,en,no child will ever walk 10km to school gogos makhulu win t hire bakkies for clinic visit motorist win t have to drive to town for fuel etcnb not mean to offend anyone it merely a suggestion i stand to be correct,0
200152,en,good ol albert,0
200153,en,spend some time in ghana such a fun place to spend this fine day august 27 1963 wonder how the civil right march will go tomorrow i know my bois will kill it,0
200154,en,and nobody do anything while pleople die why this cruel indifference why,0
200155,en,ahhhhhh my hand give grow tire from all the write but i be so grateful to announce the publication of my second work lady don t jump off your seat do get ready for some reflection upon marriage go get your copy now xoxo 1700,0
200156,en,in the mood for a diy spa day pamper yourself and your skin with luxurious yet affordable equal skincare product include equal product in your skincare regime today,0
200157,en,protest again this saturday 9am in front of balise toyota scion west springfield riverdale rd and sunday 9 be at intersection birnie ave and prospect,0
200158,en,on the anniversary of woman gain the right to vote and stand for office in politics in turkey we proudly declare that we respect the right of all woman start with our associate in our workplace and we act together to build a more equal world,0
200159,en,strike strike strike we need to stand up for woman s right woman deserve equal pay and equal right the triangle shirtwaist factory need to have good work condition we need to be equal,0
200160,en,100 follower my heart go out to the community a it have show to be the most inclusive and sweet group ive ever come across on the internet shoutout to for be my 100th follower,0
200161,en,caption exist in post happy men s day,0
200162,en,be around the corner which mean it s time for a that we d love for you to be a part of t amp c apply final entry image will be choose by basis amp will feature in our video release on march 8th 2022,0
200163,en,this be the year yes to woman be to give and take equal opportunity at all level and in all field it s all about ability capability and responsibility we a woman have same if not more,0
200164,en,to all the lovely lady,0
200165,en,here s some halftime entertainmmt for y all watch the v game i still have nightmare about this block,0
200166,en,let s celebrate international 2022 and help to collectively for woman around the world,0
200167,en,afghan woman can not be part of any sport include cricket a that would expose their body the taliban,2
200168,en,we write our song strong woman to celebrate the woman in our life and the achievement of woman all over the world,0
200169,en,for all the womens out there,0
200170,en,just eat a big dinner with and friend to celebrate 3 pureblood able to coast by no lame vaccine check or anything thankfully seem the commie aren t get the entire script from who and the wider cathedral kinda business a usual again,0
200171,en,what a wonderful advert for the brilliant vaccine programme continue to save life improve quality of life amp reduce strain on nh service this be one fantastic reason for the nh to be cherish by public everyday,0
200172,en,shivaami be join the force this to by bring leading woman entrepreneur to share their success story online register here 8th march 2022time 3 pm to 5 pm,0
200173,en,this be the day to salute all woman s struggle to secure a dignified place woman be inspiration for others in so many way my special honor tribute amp respect to madam happy,0
200174,en,custom color inspirational aviation gift funny pilot mug amelia earhart quote ceramic coffee cup mug for her,0
200175,en,to all woman deserve of their special day nollaigh na mban shona daoibh,0
200176,en,feel that i have raise a caring amp love 13 yo who be our next gen feminist amp ally i be cry of joy inside when i get this text not only we must for woman we need to do it for our child,0
200177,en,above all be the heroine of your life not the victim nora ephron click here for 48 inspirational quote for woman,0
200178,en,womensday 1,0
200179,en,may i ask when you will announce the theme for 2022 iwd i m look ahead to programming and try to work with your theme each year thanks,0
200180,en,lauren case owner of bun bakery share her insight with u what be your most valuable tip to share with other woman entrepreneur in 2021 be patient be alert be understanding be kind to yourself amp persevere,0
200181,en,hearth,0
200182,en,how can the right be sooo wrong,0
200186,en,i m bring this discussion back up today because woman have be marginalize and physically take advantage of it s time we fight and vote to speak once again for allvotebluein2022,3
200187,en,be for vote for beto,0
200189,en,daughter be take me to va today may i say i really dislike the pain from fall ugh have a good day folk so much to do in so little time,0
200190,en,completely agree never before have i felt a voting decision should be make on the basis of one policy both and be off my list it s not without a big sigh that i say the look like the only option so far,0
200191,en,the distorted moral narrative of religious nationalism 1 of the 5 interlocking injustice evils that the challenge and fight back against,0
200192,en,for woman everywhere,0
200196,en,we see you here s 10 queer woman who change history,0
200197,en,this be no joke iran be join the u n woman right commission on march 25 2022,0
200198,en,dear ene who just turn 2 y o give to his mom elif yal n who s be jail in gebze for 8 month in turkey mom and son have be for 2 day in the quarantine ward busu a ortakolma,0
200200,en,thank you cecilt strong that be brave and brilliant and spot on thank you,0
200204,en,we can t even have a day without woman make it about themselves,1
200206,en,niggas wouldn t last a day without woman argue w ya mama,0
200208,en,again darling male fragility do some reading on a day without woman in the economy however pay family time be well for the economy and society in all way and regardless of gender you must think capitalism wage quality of life and gpd be disconnect,0
200213,en,have a day without woman no work and no sex see how they like that strike,1
200216,en,enough be enough instead of a day without woman let s do a month without black teacher ally feel our absence the same way you want u absent from this country s history,0
200217,en,can t go a day without woman womening,1
200220,en,we need a day without woman all call in sick across the country,1
200221,en,he be abusive he be the problem porsha s get issue but she didn t deserve mental and physical abuse or to grieve the loss of her child alone,0
200223,en,abuse mentionnah it s so whack to me that some people don t agree with that statement like i know action speak loud than word but also it s a literal abuser,0
200224,en,i don t usually care about the kardashians but people who use abuse to control their partner get a special type of ire from me as well a people medium not you who give them a platform for entertainment without realize what s happen or care,0
200225,en,i m just an apologetic canadian willing to give the guy some sympathy biden i mean elder abuse in the open shameful,0
200227,en,rino get the rack exclusive van taylor accuse of extramarital affair with isi bride abuse of power rim job text via,0
200229,en,child abuse i m not anti vax but i be anti fear you can t tell me this be healthy she know she s do it for others you tell her that,0
200230,en,it s great that the washington post have just discover civil asset forfeiture abuse reason magazine have be write about it for many year now and the institute for justice have be fight against it in the court for year donate to ij to help the fight,0
200231,en,he use hi influence to mentally and physically force a young woman into sleep with him she have to give her emotion to ease the pain it s still abuse and rape,3
200232,en,he s one of my favorite it make me ill that he s have to endure the mental abuse this market have heap on him and for all the hater neither he or i care,0
200233,en,our government,0
200234,en,guardianship authority amp self funded government trustee corporation have be use fund belong 2 involuntary client procure via elder abuse report 2 fight them in court if they or their family attempt 2 regain their liberty amp control of their asset,0
200235,en,1 our tax fund go toward these equity company and consultant they charge in the ten of thousand to emotionally confuse and abuse our child they charge taxpayer school thousand just to have one consultation i refuse my tax money to go toward this,0
200237,en,smithsonian tropical research institute hit with sex abuse claim via at least 16 woman come forward to allege sexual harassment and abuse at smithsonian s tropical research institute which be on an island in the panama canal,3
200238,en,abuse be wrong but tell him to shut the fuck up and put a performance in isn t wrong why be he always write essay,0
200239,en,you say just wait out the republican s tantrum misinformation stock manipulation voter suppression blatant racism abuse s of woman s an immigrant and basic human right fail insurrection whoa,0
200240,en,grant marius be the less evil since he didn t sexually abuse armand as far a i m aware but he do basically make armand into a dependent partner since armand have no way of leave nor would he have want to leave because he didn t know anything else,0
200241,en,healthy androcentrism at it fine lady and gentleman,0
200242,en,they ve manage to substitute something that they say be bad androcentrism for something that be arguably bad if only for the fact that it be do deliberately in a short a space of time a possible some would say only idiot do thing like that,0
200243,en,do you even know anything about basic feminism or biology the female body be different from the male body and this fact be the basis for female oppression include to this day in the form of medical misogyny and androcentrism literally cost life,0
200245,en,if you re at spsp in person be sure to check out my symposium with and it s rain men how androcentrism shape our everyday live this saturday 8 9 be i unfortunately win t be there in person but come see everyone else,0
200246,en,get doom abstract on why androcentrism be be the new longevists,0
200247,en,leni v the world po ba kabi kabila from ferdinand jr isko lacson androcentrism be too 1900 s goiz,0
200249,en,it s just so very astound to me the feminist scholar who be one of the first to challenge androcentrism and patriarchy in international law be elect a member of the icj and not a human right body be il change don t let me get my hope up please,0
200255,en,among the follow which statement be not associate with androcentrism,0
200256,en,quite excite to present my work on gender amp perception of apology a part of our symposium on androcentrism with and come learn if you should really be sorry for say sorry,0
200259,en,this video beautifully show how ridiculous androcentrism be and put all earthly religion which include man a the most central aspect of the entire universe into a sobering perspective the truth be we be insignificant,0
200261,en,androgynous mind via,0
200262,en,virginia woolf on why the best mind be the androgynous mind the marginalian,0
200263,en,nearly a century before the term nonbinary exist virginia woolf write beautifully about why the mind who embody that be the best mind,0
200264,en,my mom i give birth to you i know everything about you my passion for videogames that i wan na turn into a job my androgynous mind and my bisexual as,0
200265,en,timeless essay and nonfiction by great writer in each of u two power preside one male one female the androgynous mind be resonant and porous naturally creative incandescent and undivided virginia woolf,0
200266,en,androgynous mind mainexlazada 1111supershow,0
200267,en,the androgynous mind be resonant and porous it transmit emotion without impediment it be naturally creative incandescent and undivided virginia woolf,0
200268,en,sonic youth androgynous mind experimental jet set trash and no star,0
200269,en,virginia woolf on why the best mind be the nonbinary mind via,0
200270,en,i m certainly for all intent and purpose cis female and have give this thought but specifically it s ci in the way virginia woolf talk about the androgynous mind,0
200271,en,one of my sy favs tbh androgynous mind bull in the heather self obsess and sexxee maybe,0
200273,en,hey no worry don t sweat it kinda have an androgynous mind so shrug you re not the first be sure you win t be the last,0
200274,en,earth angel androgynous mind,0
200275,en,average hacker fan vs average earth angel androgynous mind enthusiast,0
200276,en,splendid woman i wonder where this fit in relation to virginia woolf on the androgynous mind woolf wasn t speak anatomically of course i also wonder if she woolf sometimes try too hard to quiet potential opposition,0
